{
    "requestType"    : "trip",
    "requestVersion" : 2,
    "options"        : { "title":"My Trip", 
                         "earthRadius":"3958.8",
                         "optimization":"none" },
    "places"         : [{"name":"Denver",       "latitude": "39.7", "longitude": "-105.0"},
                        {"name":"Boulder",      "latitude": "40.0", "longitude": "-105.4"},
                        {"name":"Fort Collins", "latitude": "40.6", "longitude": "-105.1"}]
  }